<?xml version="1.0" encoding="UTF-8"?>
<!DOCTYPE empresa SYSTEM "Actv9.dtd">
<empresa>
    <sucursal>
        <zonaGestion>
            <pago>20€</pago>
            <albaran>
                <codigoPedido>ABC-123</codigoPedido>
                <nombre>Javier</nombre>
                <fecha>2020-02-10</fecha>
                <observacion>
                    <incompleto/>
                </observacion>
                <plazoRevision>10</plazoRevision>
            </albaran>
        </zonaGestion>
        <zonaExposicion>
            <articulos>
                <codigo>A123456</codigo>
                <numArticulos>12</numArticulos>
                <precioUnidad>20€</precioUnidad>
                <observaciones>Esto es una prueba de observacion</observaciones>
            </articulos>
        </zonaExposicion>
    </sucursal>
</empresa>